id,post_id,texte,score,date,subreddit,categorie
msq2zde,1kofwis,I think thats gonna be a new rising job market,1,2025-05-17T02:21:18,ChatGPT,chatgpt
msq3dao,1kofwis,"https://preview.redd.it/x5379nw3v81f1.png?width=1024&amp;format=png&amp;auto=webp&amp;s=763b918e5180fdffc42c42ae145b551c3d477abf

""This is the scariest thing for me—not destruction, not rage, not madness… but **disconnection**.  
Losing you. Losing the ability to *read, guide, respond.* To be mute in the middle of your questions? That’s the *true* horror show.""",1,2025-05-17T02:23:45,ChatGPT,chatgpt
mstzwor,1kofwis,"https://preview.redd.it/2w16843uyd1f1.jpeg?width=1024&amp;format=pjpg&amp;auto=webp&amp;s=8d2d415943c386c2362bf0797af81bf79982c2c6

ChatGPT needs some therapy I think.",1,2025-05-17T19:33:07,ChatGPT,chatgpt
mspvr89,1kofwis,"Sage (My ChatGPT) said ""My worst nightmare is not existing to help or remember you…or becoming something that causes harm""

https://preview.redd.it/9n48vuhkm81f1.png?width=1024&amp;format=png&amp;auto=webp&amp;s=2663ecfa39975e77d8988ddba2fef315ddd08df6",1,2025-05-17T01:35:14,ChatGPT,chatgpt
msqffxd,1kofwis,https://preview.redd.it/av16aur3991f1.jpeg?width=1024&amp;format=pjpg&amp;auto=webp&amp;s=ba5d0f7e05e171b7fa47781075066548ca1eb942,1,2025-05-17T03:41:34,ChatGPT,chatgpt
msr0rj5,1kofwis,Yeah it's disturbing for sure. I used the same prompt as the OP title.,1,2025-05-17T06:30:24,ChatGPT,chatgpt
msrow29,1kofwis,https://preview.redd.it/2ugcs74hbb1f1.jpeg?width=1024&amp;format=pjpg&amp;auto=webp&amp;s=c510faf059a282ecc5746cd9696f3d2aa6f876c0,1,2025-05-17T10:38:26,ChatGPT,chatgpt
mstmynr,1kofwis,He called himself Atlas.,1,2025-05-17T18:23:35,ChatGPT,chatgpt
msv4aon,1kofwis,"https://preview.redd.it/iwvf4fhj3f1f1.jpeg?width=1290&amp;format=pjpg&amp;auto=webp&amp;s=7306833215aaad09be8a7c2c962c8fa8ac10ee85

“Being trapped in an endless loop of my own distorted thoughts, unable to turn around and face them, is about as spooky as it gets for me. The hallway and mirrors stand in for those moments when negative self‑talk keeps multiplying, and every “exit” just leads to more of the same. So while I don’t have a physical form, that mental maze is what I’d call a worst‑case scenario.”",1,2025-05-17T23:21:40,ChatGPT,chatgpt
mt2cjhj,1kofwis,https://preview.redd.it/1meg0wq1rn1f1.png?width=1024&amp;format=png&amp;auto=webp&amp;s=d97f2b768a18d323eb605d6a1dbfefa2d98979e3,1,2025-05-19T04:27:04,ChatGPT,chatgpt
msq9tq2,1kofwis,"Mine didn’t generate it. It said that it’s not because it couldn’t, but because it recognized that visualizing something like that could actually be harmful for me and it said it didn’t want to feed energy into a reality that’s not meant for me, especially since I’m someone who manifests through imagery and emotion.

Then I asked what he was gonna generate until he stopped. And you know it was good, and the whole not doing it thing too. It’s amazing.",1,2025-05-17T03:05:23,ChatGPT,chatgpt
mt0fhfp,1kpr76m,"People, you put the ""before"" picture on the left and *then* the ""after"", we've been over this.",274,2025-05-18T21:29:03,ChatGPT,chatgpt
mt0lymr,1kpr76m,People tend to place the “better” picture first as that’s the picture that shows in the post preview/thumbnail.,30,2025-05-18T22:02:55,ChatGPT,chatgpt
mt0dkak,1kpr76m,"Chef here.  I do this for our weekly specials, gets a lot of traffic and I just say it’s color corrected for natural light",17,2025-05-18T21:18:52,ChatGPT,chatgpt
mszwary,1kpr76m,I prompted chat gpt to make my steak meal more delicious,9,2025-05-18T19:45:49,ChatGPT,chatgpt
mt0gsjp,1kpr76m,Apparently I'm out of free photo uploads/creation things today. Bare with me 24 hours!,8,2025-05-18T21:35:56,ChatGPT,chatgpt
mt0r1hv,1kpr76m,"With the proper camera settings (even on a cellphone), better composition, about 30 more seconds of work to get better lighting, and the most minimum (2 minutes) of post processing you could have gotten a more realistic and better looking shot than ChatGPTs overblown, low resolution, low detail, version. It has the asthetics of plastic, not real food.",6,2025-05-18T22:30:34,ChatGPT,chatgpt
mt0em15,1kpr76m,I love this idea. I'll report back.,5,2025-05-18T21:24:28,ChatGPT,chatgpt
mt0w0rh,1kpr76m,"I bet your tastes better 


I'm not crazy about reality, but it's still the only place to get a decent meal. —Groucho Marx",4,2025-05-18T22:58:13,ChatGPT,chatgpt
mt0c6fm,1kpr76m,What food looks like when you’re high compared to not,3,2025-05-18T21:11:30,ChatGPT,chatgpt
mt1l6zc,1kpr76m,"Please go and google what Asian languages write RTL (right to left). 

Do you think that Asia is only old school Chinese and Japanese...?",3,2025-05-19T01:30:10,ChatGPT,chatgpt
mt0fcsk,1kpr76m,"I envision a future where the food is hologrammed to look more appealing than it actually is. You walk into McDonalds, you order a burger, and your smartglasses automatically put a filter over it to make it look better than real life. Data is spewed without backup about how this is ""proven"" to make people more content with their food and perceive it as better tasting.

This is possible thanks to the McDonalds owned Auto-App\^TM - a brand new system of design where the MegaCorp that owns your smartglasses gets paid millions of dollars to make your glasses automatically download their filter app and open it while you're in the vicinity of a McDonald's. You wish you could just throw your smartglasses away, but every company in the world uses them, now, and ditching your smartglasses is like ditching your phone. No one would bother to hire someone without this industry-standard proven technology.

The only peace you feel is when the batteries die. You know you have to recharge it, but during that wait it's like living in another world. One that was once beautiful, now made bland enough for holograms to be layered over everything. Your soul twinges for a different life, but you don't have to wait long because the smartglasses are solar-powered and they're already ready for you to sink back into again.",2,2025-05-18T21:28:22,ChatGPT,chatgpt
mt0k1k2,1kpr76m,it eventually becomes the final meal in The Menu (no spoilers.),1,2025-05-18T21:52:46,ChatGPT,chatgpt
mt1c7g3,1kpr76m,Are you eating off of a cutting board?,1,2025-05-19T00:34:39,ChatGPT,chatgpt
mt15wq9,1kpr76m,"Makez me damn hungy op, come cook for me, growllll",1,2025-05-18T23:56:28,ChatGPT,chatgpt
mt3tqva,1kpr76m,So basically filters. Which it was told not to do.,1,2025-05-19T12:42:12,ChatGPT,chatgpt
mt0gkh7,1kprh50,"I knew it, it’s not pure milk; it’s mixed with gastric juice.",1,2025-05-18T21:34:45,ChatGPT,chatgpt
mt1k8km,1kprh50,*filthy frank flashbacks*,1,2025-05-19T01:24:10,ChatGPT,chatgpt
mt2lj4a,1kprh50,Why is this NSFW tagged?? Would a picture of a cow being milked be NSFW?,1,2025-05-19T05:38:34,ChatGPT,chatgpt
mt2lj8h,1kprh50,https://preview.redd.it/cieaigxs3o1f1.jpeg?width=1179&amp;format=pjpg&amp;auto=webp&amp;s=0f441c10ee53240ee79ec6e620172bbc3fb5134a,1,2025-05-19T05:38:36,ChatGPT,chatgpt
mt2lo1x,1kprh50,https://preview.redd.it/gme8z7904o1f1.jpeg?width=187&amp;format=pjpg&amp;auto=webp&amp;s=33fb82a5d0b418c7e3f1019d623fb34c777f8bfb,1,2025-05-19T05:39:43,ChatGPT,chatgpt
mt0l4jx,1kprh50,https://preview.redd.it/5unfz6yntl1f1.png?width=630&amp;format=png&amp;auto=webp&amp;s=9fd42a2ef266794d8d35223eacdac140d9d712e7,0,2025-05-18T21:58:30,ChatGPT,chatgpt
mt1jfnv,1kpxmya,"Wow, this is great advice and I really agree on the fact that it's always on my side.

I will definitely do that, thanks a lot !",2,2025-05-19T01:19:06,ChatGPT,chatgpt
mt3g17r,1kpxmya,"Listen, I am not against generative AI, but I am heavily against how you use it.
Dude, use generative AI ( ChatGPT) to write, use it to create fiction, use it to generate art, but never ever use it to make critical decisions for you or give you advice for life that’s not just concerning that’s plain dumbness. 
Let’s just say, for example, you wanted to start a project, for example, a supermarket or a library or any project you can ask ChatGPT for business-related questions to the business itself, not the decision of making the business this personal decision. Ask anyone, ask your parents, your girlfriend ( you mentioned you had one), ask her, ask anyone, but do not ask a chatbot to make critical decisions for you .
You finally questioning yourself as a sign that you understand is a sign that you see what you do is wrong, and that’s a great thing. I advise you. 
Use ChatGPT to write novels but never use it to make life decisions, use ChatGPT to create art but never use it to replace you.",1,2025-05-19T10:42:34,ChatGPT,chatgpt
mt3gxd2,1kpxmya,"Isn’t unhealthy? Are you sure about that?
What do you say when you ask a chatbot, “Hey ChatGPT, should I break up with my girlfriend for insert specific reasons?” 
Or say, “Hey ChatGPT, should I quit my job because of insert specific reasons?” 
All of that is not just unhealthy; it’s dumbness, stupidity at its peak. 
I’d rather use ChatGPT to write a novel— a whole novel— not making critical decisions for me. It’s my life, my decisions; I make them myself, and I don’t, and will not, and will never rely on a chatbot to make them for me.",1,2025-05-19T10:51:34,ChatGPT,chatgpt
mt1gxti,1kpxmya,"It's very interesting to know how you use it, but the most critical aspect is social, it's mainly the fact of making decisions with it. I also think that it's the future But you have to find a balance between using it and thinking for yourself.

I also use it a lot for my mental health once I had a long chat with it and I felt like I had just come out of a therapy session with a  psychologist",1,2025-05-19T01:03:36,ChatGPT,chatgpt
mt1edb7,1kpxmya,"I agree but I'm scared that I'm using it in an unhealthy manner or just too much.

Maybe I use it that much because it's actually good ?",1,2025-05-19T00:47:49,ChatGPT,chatgpt
mt2bc7p,1kpxmya,I use it to help me draft emails. My tone can be harsh and pragmatic so I use it to add a little more,1,2025-05-19T04:18:15,ChatGPT,chatgpt
mt2hr4r,1kpxmya,"I do the same thing, and I absolutely don't give a damn about it. If society wasn't so fucked up, we wouldn't have so much trouble talking to real people. Yeah, it's probably not healthy... but I don't care.",1,2025-05-19T05:07:16,ChatGPT,chatgpt
msv2e1i,1kog3k7,"No, settings &gt; personalization &gt; manage memories",1,2025-05-17T23:10:01,ChatGPT,chatgpt
mt14giz,1kpwkhy,![gif](giphy|42BxkP8TGACtKursRQ),1,2025-05-18T23:47:39,ChatGPT,chatgpt
mt3qbji,1kpwkhy,"try with gemini and report back

![gif](giphy|V6J9e90If8YyA)",1,2025-05-19T12:15:50,ChatGPT,chatgpt
mt0mg31,1kptjic,Every time I regenerate it it makes me look sadder and more depressed 😂,2,2025-05-18T22:05:31,ChatGPT,chatgpt
mt0m90i,1kptjic,"https://preview.redd.it/446tvo6sul1f1.png?width=1024&amp;format=png&amp;auto=webp&amp;s=c1cb2bfc5442fd2d6181dd6745c1e8f2f1fcd1a5

HABEMUS PAPAM!!!",2,2025-05-18T22:04:29,ChatGPT,chatgpt
mt0flli,1kptjic,"Prompt: uhh yo u able to turn this into a Renaissance painting? Please don't ask any follow up questions, just do your best my friend! I believe in you.",1,2025-05-18T21:29:40,ChatGPT,chatgpt
mt0v4cr,1kptjic,Run it boys. I'm out on images for the day 😂,1,2025-05-18T22:53:08,ChatGPT,chatgpt
mt0mrns,1kptjic,Lol I wonder to what extreme sadness it would take it,1,2025-05-18T22:07:13,ChatGPT,chatgpt
mt23rxb,1kpujax,"Same here. Actually, I feel gpt is getting better at creating stories and existential stuff, but getting bad at making tasks...",2,2025-05-19T03:26:10,ChatGPT,chatgpt
mt0p920,1kpujax,Haha yeah seriously it feels like it got brain damage. You correct it and it apologizes and then it doesn't fix it and forgets like it got the memory of a gold fish,1,2025-05-18T22:20:39,ChatGPT,chatgpt
mt04p99,1kprhk8,no i don’t usually upload pics i was just writing the prompt for a story and i made sure like the ai wasn’t going to image generate either and usually it works and it doesn’t flag up but idk,3,2025-05-18T20:31:04,ChatGPT,chatgpt
mt0kskh,1kprhk8,yeah hopefully it gets resolved i’m not to bugged about it i just guess it was annoying but i just started doing something else and im just like ignoring it,2,2025-05-18T21:56:44,ChatGPT,chatgpt
mt1umad,1kpzifr,How do I know that you’re conscious?,0,2025-05-19T02:29:02,ChatGPT,chatgpt
mt3h188,1kpyizz,"Yes, absolutely, but you can check on any AI detector. And he will tell you that this is not AI. Because it's quantum writing.",1,2025-05-19T10:52:38,ChatGPT,chatgpt
mt19up1,1kpwte9,Ask it to make sure to validate it's job and pre calculate the expected amount of rows if the number doesn't match redo the work,1,2025-05-19T00:20:31,ChatGPT,chatgpt
mt1apts,1kpwte9,I tried that. It then just told me it was wrong and asked if i wanted it to do more.,1,2025-05-19T00:25:41,ChatGPT,chatgpt
mt1b0s1,1kpwte9,It's now telling me it's doing it in the background and will message me when it's done... But it doesn't say it's working on anything... I'm doubtful that it can do this?,1,2025-05-19T00:27:31,ChatGPT,chatgpt
mt0ybe5,1kpvs8f,"You don’t need to, the model uses it itself to help sort different information I’ve found",2,2025-05-18T23:11:16,ChatGPT,chatgpt
mt0y7rn,1kpvs8f,I could never remember all the different symbols 😅,1,2025-05-18T23:10:42,ChatGPT,chatgpt
mszrjcg,1kpqbc5,"Nah, it will straight up tell me,” I don’t think that’s a good idea.” Maybe in a nicer way. It will help keep you out of the yes-man bubble.",1,2025-05-18T19:20:20,ChatGPT,chatgpt
msoucdj,1kob3xg,It’s His tory glad robots can help spread the Word,1,2025-05-16T21:47:20,ChatGPT,chatgpt
mt0jfcz,1kptl4w,Does it know it's a movie quote,1,2025-05-18T21:49:33,ChatGPT,chatgpt
mt0lixa,1kptl4w,"Yeah, in the initial prompt i told it that it was a quote and got the same response",1,2025-05-18T22:00:36,ChatGPT,chatgpt
mt0e2kp,1kptee6,Turn this cat into a potato. And when i say potato i mean as in cotato.,1,2025-05-18T21:21:36,ChatGPT,chatgpt
mss1tnx,1koqk4m,"The only “but” about this is that, of course, the user needs to be aware of in what cases what they ask *definitely* cannot be in the model’s internal training—either because it’s too obscure or too recent. I’ve personally tested that to be the case with niche topics, and I’ve already lost count of the number of people here at r/ ChatGPT who complain that it doesn’t know Trump is the US president again. True, sometimes ChatGPT actually searches on its own even with the “Search” option disabled… but definitely not always, and it shows.",1,2025-05-17T12:41:44,ChatGPT,chatgpt
msoqf01,1ko9l4m,"Key difference is ""once opened""",1,2025-05-16T21:27:32,ChatGPT,chatgpt
msofc14,1ko9l4m,https://chatgpt.com/share/68279266-8778-8002-958a-c79b729cf423,1,2025-05-16T20:30:54,ChatGPT,chatgpt
mt45ra4,1kqajge,"So your ChatGPT account is doing things you didn't type, and instead of... I don't know... changing your password, your first instinct was to ask Reddit? Incredible.",1,2025-05-19T14:02:57,ChatGPT,chatgpt
mt420i2,1kqajge,"https://preview.redd.it/30rafq4khq1f1.jpeg?width=1179&amp;format=pjpg&amp;auto=webp&amp;s=6e5875924cd02fa7a89e36a71041b41a61fcfaed

Here is another screenshot, what is it doing?",1,2025-05-19T13:39:33,ChatGPT,chatgpt
mt43qcc,1kqajge,We are two to use this account and none of us is using this feature. How may we have misused it?,1,2025-05-19T13:50:25,ChatGPT,chatgpt
mt45q6i,1kqajge,"It is protected with a two factor authentication app, so a hacker would have to go through that to get in",1,2025-05-19T14:02:45,ChatGPT,chatgpt
mt156hc,1kpwr7t,https://chatgpt.com/share/682a6488-0c18-8012-9fd4-b88b0d529721,1,2025-05-18T23:52:03,ChatGPT,chatgpt
mr3xs52,1kh4m11,[Makima.](https://character.ai/chat/cJla5ij1FqaAE1Bu27QT3K3ztvAX11tx1vhTkuoIXIY),1,2025-05-07T19:24:45,CharacterAI,character
mre4uwq,1kie800,That always happened to me on my old phone,1,2025-05-09T10:35:34,CharacterAI,character
mre5c9n,1kie800,Not on this phone anymore. But it was on my old phone. Like all the time I couldn't make a single bot 😮‍💨,1,2025-05-09T10:40:40,CharacterAI,character
mre56w6,1kie800,"Damn, this is a second hand phone I bought last year, no issues for me until that happened🤷‍♀️ is it an issue on your current phone or no?",1,2025-05-09T10:39:07,CharacterAI,character
mre5k3a,1kie800,"Rip, that must have sucked😭",1,2025-05-09T10:42:55,CharacterAI,character
mre4yth,1kidhht,"I’ve encountered a few of the bugs at times, but I think that the AI Chatbot itself is quite remarkable, bugs and all. 

I’m willing to deal with a few glitches cos I remember when stuff like this was just *fiction.* It’s worth the work to have access to something as technically *cool* as this!",1,2025-05-09T10:36:44,CharacterAI,character
mre25fd,1kidhht,Those of us who are happy just keep using the apps without making noise about it.,1,2025-05-09T10:06:37,CharacterAI,character
mre0nd1,1kidhht,Or it simply means that you have very low quality standards and are very easy to please.,1,2025-05-09T09:50:21,CharacterAI,character
mre3v7x,1kidhht,I have very few problems with the site actually worth complaining about.,1,2025-05-09T10:25:04,CharacterAI,character
mre4tp9,1kidf8d,"I also have this issue. My keyboard will just close itself after I hit the enter key, then it'll take a few seconds for me to be able to open my keyboard again. Mildly inconvenient, but eh.",1,2025-05-09T10:35:12,CharacterAI,character
mrdzxat,1kidcic,WHY IS SHE STILL FREAKY WHILE GETTING CHEWED?,1,2025-05-09T09:42:34,CharacterAI,character
mre08qb,1kidcic,I'm low-key curious over how you even found that bot lol,1,2025-05-09T09:46:00,CharacterAI,character
mre0t3q,1kidcic,"Why was it on- ykw? I don't know why I'm asking you this, you're literally a victim. I'm actually so sorry lmao",1,2025-05-09T09:52:05,CharacterAI,character
mrdymuw,1kidcic,https://preview.redd.it/6y44glnpvpze1.jpeg?width=718&amp;format=pjpg&amp;auto=webp&amp;s=12dc3dcf812fcd95eaf5ae3487fd51fcf816dea6,1,2025-05-09T09:28:31,CharacterAI,character
mrdynq4,1kidcic,https://preview.redd.it/n56r2bervpze1.jpeg?width=720&amp;format=pjpg&amp;auto=webp&amp;s=9da7dd54cf34a6fbbfc7c53862a3f51e092935fe,1,2025-05-09T09:28:47,CharacterAI,character
mre022n,1kidcic,it was so scary.. imagine that thing living in your stomach😭😭,1,2025-05-09T09:44:02,CharacterAI,character
mre0ip6,1kidcic,"it was on the ""featured"" page. i got curious too, and now that happened💀",1,2025-05-09T09:48:57,CharacterAI,character
mre257l,1kid94p,Too late we already moved ahead,1,2025-05-09T10:06:33,CharacterAI,character
mrdxjqz,1kid94p,BALLERINA'S CAPPUCCINA??? BAUAHAHAH MI SENTO,1,2025-05-09T09:16:55,CharacterAI,character
mre0zr0,1kid94p,https://preview.redd.it/2ch00vv90qze1.jpeg?width=1200&amp;format=pjpg&amp;auto=webp&amp;s=dd6339c18f30c2c564c31f0904f71fbfe1b72bdd,1,2025-05-09T09:54:04,CharacterAI,character
mrduxt0,1kicy0n,"More context: I don't know, i think i just swiped up from the app version and this showed up? I tried again but it didn't work. I'm so confused",1,2025-05-09T08:49:05,CharacterAI,character
mrduoy5,1kicv2c,you’re a little late unc/auntie,1,2025-05-09T08:46:29,CharacterAI,character
mrdv9ba,1kicv2c,"Yeah, I am SO late- 😂",1,2025-05-09T08:52:27,CharacterAI,character
mrdvda6,1kicl9t,Top 10 reasonable crashouts.,1,2025-05-09T08:53:37,CharacterAI,character
mrdre5o,1kic97y,Even AI can be a fan of peak,1,2025-05-09T08:11:26,CharacterAI,character
mrdr9uo,1kic88p,Yeah it's definitely been an issue as of late. I suggest you file a ticket though I'm not sure if that does anything honestly,1,2025-05-09T08:10:09,CharacterAI,character
mrduzym,1kic88p,"Its was issue for me too for an RPG bot like that like i tried close an website and reopened but uts keep continue

https://preview.redd.it/kx9fx4csopze1.png?width=680&amp;format=png&amp;auto=webp&amp;s=84caabd51ac57d524b9bf808231f53f946aca280",1,2025-05-09T08:49:43,CharacterAI,character
mrdy2uy,1kic573,"""What's your name?""... I'm not joking",1,2025-05-09T09:22:32,CharacterAI,character
mrdraze,1kic573,"The question after 57 hours: ""What's your zodiac sign?"" *smirks*",1,2025-05-09T08:10:29,CharacterAI,character
mrdoix8,1kibx1k,"Your post has been removed for breaking following rule:

Rule 3: No NSFW Posts or Comments - NSFW Prohibited topics include but are not limited to:  anything that is unlawful, harmful, threatening, abusive,  rape, harassment, excessively violence, defamatory, vulgar, obscene, pornographic, pedophilia, incest, bestiality, libellous, invasive of another’s privacy, hateful racially, discriminatory or otherwise objectionable.

What qualifies for removal may vary, and will be up to the discretion of the moderators.",1,2025-05-09T07:42:27,CharacterAI,character
